{
  "version": "1",
  "timestamp": "2026-02-20T01:05:01.536Z",
  "compiler": {
    "name": "urd-compiler",
    "version": "0.1.3",
    "language": "rust"
  },
  "summary": {
    "total_tests": 480,
    "passed": 480,
    "failed": 0,
    "skipped": 0,
    "duration_ms": 398,
    "pass_rate": 1
  },
  "phases": [
    {
      "name": "parse",
      "diagnostic_range": "100-199",
      "tests": 124,
      "passed": 124,
      "failed": 0,
      "skipped": 0,
      "duration_ms": 10,
      "categories": [
        {
          "name": "bad",
          "tests": 2,
          "passed": 2,
          "failed": 0,
          "test_names": [
            {
              "name": "bad_frontmatter_line",
              "status": "pass",
              "duration_ms": null
            },
            {
              "name": "bad_line_in_content",
              "status": "pass",
              "duration_ms": null
            }
          ]
        },
        {
          "name": "block",
          "tests": 1,
          "passed": 1,
          "failed": 0,
          "test_names": [
            {
              "name": "block_style_lists_rejected",
              "status": "pass",
              "duration_ms": null
            }
          ]
        },
        {
          "name": "blocked",
          "tests": 1,
          "passed": 1,
          "failed": 0,
          "test_names": [
            {
              "name": "blocked_message",
              "status": "pass",
              "duration_ms": null
            }
          ]
        },
        {
          "name": "bom",
          "tests": 1,
          "passed": 1,
          "failed": 0,
          "test_names": [
            {
              "name": "bom_stripping",
              "status": "pass",
              "duration_ms": null
            }
          ]
        },
        {
          "name": "choice",
          "tests": 5,
          "passed": 5,
          "failed": 0,
          "test_names": [
            {
              "name": "choice_body_with_blank_lines",
              "status": "pass",
              "duration_ms": null
            },
            {
              "name": "choice_indent_level_tracking",
              "status": "pass",
              "duration_ms": null
            },
            {
              "name": "choice_with_entity_target",
              "status": "pass",
              "duration_ms": null
            },
            {
              "name": "choice_with_section_target",
              "status": "pass",
              "duration_ms": null
            },
            {
              "name": "choice_with_type_target",
              "status": "pass",
              "duration_ms": null
            }
          ]
        },
        {
          "name": "containment",
          "tests": 1,
          "passed": 1,
          "failed": 0,
          "test_names": [
            {
              "name": "containment_condition",
              "status": "pass",
              "duration_ms": null
            }
          ]
        },
        {
          "name": "destroy",
          "tests": 1,
          "passed": 1,
          "failed": 0,
          "test_names": [
            {
              "name": "destroy_effect",
              "status": "pass",
              "duration_ms": null
            }
          ]
        },
        {
          "name": "empty",
          "tests": 2,
          "passed": 2,
          "failed": 0,
          "test_names": [
            {
              "name": "empty_choice_label",
              "status": "pass",
              "duration_ms": null
            },
            {
              "name": "empty_frontmatter",
              "status": "pass",
              "duration_ms": null
            }
          ]
        },
        {
          "name": "entity",
          "tests": 3,
          "passed": 3,
          "failed": 0,
          "test_names": [
            {
              "name": "entity_declaration",
              "status": "pass",
              "duration_ms": null
            },
            {
              "name": "entity_presence",
              "status": "pass",
              "duration_ms": null
            },
            {
              "name": "entity_speech",
              "status": "pass",
              "duration_ms": null
            }
          ]
        },
        {
          "name": "exhaustion",
          "tests": 1,
          "passed": 1,
          "failed": 0,
          "test_names": [
            {
              "name": "exhaustion_condition",
              "status": "pass",
              "duration_ms": null
            }
          ]
        },
        {
          "name": "exit",
          "tests": 6,
          "passed": 6,
          "failed": 0,
          "test_names": [
            {
              "name": "exit_children_with_blank_lines",
              "status": "pass",
              "duration_ms": null
            },
            {
              "name": "exit_declaration",
              "status": "pass",
              "duration_ms": null
            },
            {
              "name": "exit_non_child_content",
              "status": "pass",
              "duration_ms": null
            },
            {
              "name": "exit_qualified_jump",
              "status": "pass",
              "duration_ms": null
            },
            {
              "name": "exit_with_children",
              "status": "pass",
              "duration_ms": null
            },
            {
              "name": "exit_with_deep_children",
              "status": "pass",
              "duration_ms": null
            }
          ]
        },
        {
          "name": "file",
          "tests": 1,
          "passed": 1,
          "failed": 0,
          "test_names": [
            {
              "name": "file_size_limit",
              "status": "pass",
              "duration_ms": null
            }
          ]
        },
        {
          "name": "frontmatter",
          "tests": 21,
          "passed": 21,
          "failed": 0,
          "test_names": [
            {
              "name": "frontmatter_entity_override_with_comment",
              "status": "pass",
              "duration_ms": null
            },
            {
              "name": "frontmatter_enum_with_comment",
              "status": "pass",
              "duration_ms": null
            },
            {
              "name": "frontmatter_hash_inside_quoted_string_preserved",
              "status": "pass",
              "duration_ms": null
            },
            {
              "name": "frontmatter_hash_inside_single_quoted_string_preserved",
              "status": "pass",
              "duration_ms": null
            },
            {
              "name": "frontmatter_hidden_property_with_comment",
              "status": "pass",
              "duration_ms": null
            },
            {
              "name": "frontmatter_nesting_depth",
              "status": "pass",
              "duration_ms": null
            },
            {
              "name": "frontmatter_no_urd430_for_blank_line",
              "status": "pass",
              "duration_ms": null
            },
            {
              "name": "frontmatter_no_urd430_for_bracket_start",
              "status": "pass",
              "duration_ms": null
            },
            {
              "name": "frontmatter_no_urd430_for_lowercase",
              "status": "pass",
              "duration_ms": null
            },
            {
              "name": "frontmatter_no_urd430_for_valid_type",
              "status": "pass",
              "duration_ms": null
            },
            {
              "name": "frontmatter_no_urd430_for_whole_line_comment",
              "status": "pass",
              "duration_ms": null
            },
            {
              "name": "frontmatter_no_urd432_for_comment_in_entities",
              "status": "pass",
              "duration_ms": null
            },
            {
              "name": "frontmatter_no_urd432_for_valid_entity",
              "status": "pass",
              "duration_ms": null
            },
            {
              "name": "frontmatter_property_default_with_comment",
              "status": "pass",
              "duration_ms": null
            },
            {
              "name": "frontmatter_property_type_with_comment",
              "status": "pass",
              "duration_ms": null
            },
            {
              "name": "frontmatter_type_def_with_comment",
              "status": "pass",
              "duration_ms": null
            },
            {
              "name": "frontmatter_type_def_without_comment_regression",
              "status": "pass",
              "duration_ms": null
            },
            {
              "name": "frontmatter_urd430_missing_colon",
              "status": "pass",
              "duration_ms": null
            },
            {
              "name": "frontmatter_urd430_unparseable_type_like_line",
              "status": "pass",
              "duration_ms": null
            },
            {
              "name": "frontmatter_urd432_malformed_entity",
              "status": "pass",
              "duration_ms": null
            },
            {
              "name": "frontmatter_world_field_with_comment",
              "status": "pass",
              "duration_ms": null
            }
          ]
        },
        {
          "name": "heading",
          "tests": 1,
          "passed": 1,
          "failed": 0,
          "test_names": [
            {
              "name": "heading_inline_comment",
              "status": "pass",
              "duration_ms": null
            }
          ]
        },
        {
          "name": "import",
          "tests": 1,
          "passed": 1,
          "failed": 0,
          "test_names": [
            {
              "name": "import_declaration",
              "status": "pass",
              "duration_ms": null
            }
          ]
        },
        {